{"artifacts":[{"name":"main.pdf","sha256":"ae8d89e90ece0dcefab83ba44b2fd1e9de73ba7d04abe7501192b085ab652ca0"},{"name":"manual.pdf","sha256":"19df9a7711861bb0cbc1a5e71491d3b605ff73a4bf05bbf108241b9f3f4c5112"},{"name":"manual-2.pdf","sha256":"aa0c9641b7d523695cd0aa1236c3f18712768deb472e3bb22a67dc3a46772d42"},{"name":"source.zip","sha256":"a4bf11e72f26dbbf9d3c0fd5ce2a46fa9cba7cc40f954875f20bf369e736b8b6"}],"canonical_bundle_availability":"embedded_as_stable_payload_in_complete_bundle","dependency_id":"AOD","payload_manifest_sha256":"420479ac2a36849ea55bdda3883ce655299781e3795cc2efbd74b5ed3044f447","schema_version":"3.1","snapshot_id":"AOD_STABLE_BOOTSTRAP_v40_03r12_GO","source_bundle_filename":"bundle-v40.03r12-go.zip","source_bundle_sha256":"de05e092b400f11fa61113a539b6a8b7bcb3d9fdb2e3495b2ef5b24a212b801f","status":"content_addressed_stable_baseline_descriptor","version":"v40.03r12"}
