{"artifacts":[{"name":"main.pdf","sha256":"ae8d89e90ece0dcefab83ba44b2fd1e9de73ba7d04abe7501192b085ab652ca0"},{"name":"manual.pdf","sha256":"19df9a7711861bb0cbc1a5e71491d3b605ff73a4bf05bbf108241b9f3f4c5112"},{"name":"manual-2.pdf","sha256":"aa0c9641b7d523695cd0aa1236c3f18712768deb472e3bb22a67dc3a46772d42"},{"name":"source.zip","sha256":"2de2b348622356fe628927ff4b19582a84dd1c1960a554d0bfda21e508b883c2"}],"canonical_bundle_availability":"embedded_as_stable_payload_in_complete_bundle","dependency_id":"AOD","payload_manifest_sha256":"02fe7ce0c9f6b96b22069517a0f2d15397487d381fa3a73d44c97263f87fe593","schema_version":"3.1","snapshot_id":"AOD_STABLE_BOOTSTRAP_v40_03r11_GO","source_bundle_filename":"bundle-v40.03r11-go.zip","source_bundle_sha256":"058c91a5bd13c3d8fed0773e3782b5d602e4059ec24c1f84ba1be739f74da75f","status":"content_addressed_stable_baseline_descriptor","version":"v40.03r11"}
