{"artifacts":[{"name":"main.pdf","sha256":"ae8d89e90ece0dcefab83ba44b2fd1e9de73ba7d04abe7501192b085ab652ca0"},{"name":"manual.pdf","sha256":"19df9a7711861bb0cbc1a5e71491d3b605ff73a4bf05bbf108241b9f3f4c5112"},{"name":"manual-2.pdf","sha256":"9b8c608b4e4659e1f35ca8075736397f5cd0d68d65f7f959aa676a1765803cbb"},{"name":"source.zip","sha256":"bef46a476af74e39c4daff7665665792685bb704373ee6b795dea0ee5a4fdca4"}],"canonical_bundle_availability":"embedded_as_stable_payload_in_complete_bundle","dependency_id":"AOD","payload_manifest_sha256":"620b4e8482bfa11c2963d7d03518ee5cb9890816ae2b442d30bcb67c63642a81","schema_version":"3.1","snapshot_id":"AOD_STABLE_BOOTSTRAP_v40_03r13_1_GO","source_bundle_filename":"bundle-v40.03r13.1-go.zip","source_bundle_sha256":"26fde70b8bf4436ddcffb99df6b2df65a75f6fd787a815bd3ae494ec1f948dcf","status":"content_addressed_stable_baseline_descriptor","version":"v40.03r13.1"}
