{"artifacts":[{"name":"main.pdf","sha256":"ae8d89e90ece0dcefab83ba44b2fd1e9de73ba7d04abe7501192b085ab652ca0"},{"name":"manual.pdf","sha256":"19df9a7711861bb0cbc1a5e71491d3b605ff73a4bf05bbf108241b9f3f4c5112"},{"name":"manual-2.pdf","sha256":"9b8c608b4e4659e1f35ca8075736397f5cd0d68d65f7f959aa676a1765803cbb"},{"name":"source.zip","sha256":"ef44031d00c18dac6d998498b5fb40cea9f9e238c1ad4de46a23298ce9456678"}],"canonical_bundle_availability":"embedded_as_stable_payload_in_complete_bundle","dependency_id":"AOD","payload_manifest_sha256":"26e38bd0770f468724935403ba871e77a5ac920a40d81730caf90a5bf2006158","schema_version":"3.1","snapshot_id":"AOD_STABLE_BOOTSTRAP_v40_03r14_GO","source_bundle_filename":"bundle-v40.03r14-go.zip","source_bundle_sha256":"8e3ca2bb6ace41831eb0e612301a38d55b158a4690a753ab36de744f4573e4c4","status":"content_addressed_stable_baseline_descriptor","version":"v40.03r14"}
