{"artifacts":[{"name":"main.pdf","sha256":"ae8d89e90ece0dcefab83ba44b2fd1e9de73ba7d04abe7501192b085ab652ca0"},{"name":"manual.pdf","sha256":"19df9a7711861bb0cbc1a5e71491d3b605ff73a4bf05bbf108241b9f3f4c5112"},{"name":"manual-2.pdf","sha256":"1c2f4809ac3523ebdc255fcf0b61d3f925bd52b2e593014bd40d3f153a73b369"},{"name":"source.zip","sha256":"b56d215d582514662b059b3fae266bddbb84c7815b85c023c483d42b64d72fb5"}],"canonical_bundle_availability":"embedded_as_stable_payload_in_complete_bundle","dependency_id":"AOD","payload_manifest_sha256":"325db30f52bf08bba497e6e8372c222f68db7ef5d8aa5aa0a5c388f602533d78","schema_version":"3.1","snapshot_id":"AOD_STABLE_BOOTSTRAP_v40_03r18_2_GO","source_bundle_filename":"bundle-v40.03r18.2-go.zip","source_bundle_sha256":"e67c80fdf84c171a2609c08e7fdd38df08ee416896d49a90b8dd083ba883318b","status":"content_addressed_stable_baseline_descriptor","version":"v40.03r18.2"}
