{"artifacts":[{"name":"main.pdf","sha256":"ae8d89e90ece0dcefab83ba44b2fd1e9de73ba7d04abe7501192b085ab652ca0"},{"name":"manual.pdf","sha256":"19df9a7711861bb0cbc1a5e71491d3b605ff73a4bf05bbf108241b9f3f4c5112"},{"name":"manual-2.pdf","sha256":"9b8c608b4e4659e1f35ca8075736397f5cd0d68d65f7f959aa676a1765803cbb"},{"name":"source.zip","sha256":"b1b9671f3e86456bc82bc4e12f090ab7e75d4256f1d6ddc7a11d1a1d6d34a7a4"}],"canonical_bundle_availability":"embedded_as_stable_payload_in_complete_bundle","dependency_id":"AOD","payload_manifest_sha256":"7f707c4269fbddf37b384a4c74e354f9c6d5491ba85d1fbbc099e563c4703825","schema_version":"3.1","snapshot_id":"AOD_STABLE_BOOTSTRAP_v40_03r15_2_GO","source_bundle_filename":"bundle-v40.03r15.2-go.zip","source_bundle_sha256":"f6d4633635a24905d829fa3123465cbd732db0a16dde7fb4601bf82414fb15d8","status":"content_addressed_stable_baseline_descriptor","version":"v40.03r15.2"}
