{"artifacts":[{"name":"main.pdf","sha256":"ae8d89e90ece0dcefab83ba44b2fd1e9de73ba7d04abe7501192b085ab652ca0"},{"name":"manual.pdf","sha256":"19df9a7711861bb0cbc1a5e71491d3b605ff73a4bf05bbf108241b9f3f4c5112"},{"name":"manual-2.pdf","sha256":"9b8c608b4e4659e1f35ca8075736397f5cd0d68d65f7f959aa676a1765803cbb"},{"name":"source.zip","sha256":"b70d6cf4a7ad0a3b788f0478f60c4276d5580d3a9d4f35ac5ae0ba5dd0cca4a3"}],"canonical_bundle_availability":"embedded_as_stable_payload_in_complete_bundle","dependency_id":"AOD","payload_manifest_sha256":"aefeca594454887f6c32f6f584a4fbb596e023055471fa23f401bdaf6e7cb687","schema_version":"3.1","snapshot_id":"AOD_STABLE_BOOTSTRAP_v40.03r16_GO","source_bundle_filename":"bundle-v40.03r16-go.zip","source_bundle_sha256":"3a41841a921154ab085eb3879c9cd88ca1497a1348390c776cb8bf57368fc3f0","status":"content_addressed_stable_baseline_descriptor","version":"v40.03r16"}
