{"artifacts":[{"name":"main.pdf","sha256":"ae8d89e90ece0dcefab83ba44b2fd1e9de73ba7d04abe7501192b085ab652ca0"},{"name":"manual.pdf","sha256":"19df9a7711861bb0cbc1a5e71491d3b605ff73a4bf05bbf108241b9f3f4c5112"},{"name":"manual-2.pdf","sha256":"aa0c9641b7d523695cd0aa1236c3f18712768deb472e3bb22a67dc3a46772d42"},{"name":"source.zip","sha256":"08c606b7509d0f238be35c81faefd4965f716e15c57a3ff9b02b7623a7b974f1"}],"canonical_bundle_availability":"embedded_as_stable_payload_in_complete_bundle","dependency_id":"AOD","payload_manifest_sha256":"d4b6716655040c06e7dd3428a06f4c033b240b62f8163cb3308bd3343a87e50d","schema_version":"3.1","snapshot_id":"AOD_STABLE_BOOTSTRAP_v40_03r10_6_GO","source_bundle_filename":"bundle-v40.03r10.6-go.zip","source_bundle_sha256":"120435b989b0c79fa479ff66897349837c093e0459a3cbbb6c029a744fb50a99","status":"content_addressed_stable_baseline_descriptor","version":"v40.03r10.6"}
