{"artifacts":[{"name":"main.pdf","sha256":"ae8d89e90ece0dcefab83ba44b2fd1e9de73ba7d04abe7501192b085ab652ca0"},{"name":"manual.pdf","sha256":"19df9a7711861bb0cbc1a5e71491d3b605ff73a4bf05bbf108241b9f3f4c5112"},{"name":"manual-2.pdf","sha256":"97fb356fb777607030501b482a4610a813681be6ff978570a58482bf99e65a62"},{"name":"source.zip","sha256":"83f01310bca10d6e1a59bb9349ffa6e56672b5529c10d72d5773c46b6dd781e1"}],"canonical_bundle_availability":"embedded_as_stable_payload_in_complete_bundle","dependency_id":"AOD","payload_manifest_sha256":"183ee277f6ce29ae4b7be65bd4041d5c80ede4b6440eb5c12baf4606f8e27a1f","schema_version":"3.1","snapshot_id":"AOD_STABLE_BOOTSTRAP_v40.03r09.1_GO","source_bundle_filename":"bundle-v40.03r09.1-go.zip","source_bundle_sha256":"05073223fbf35c62968a19a7a05809c55e73a098a1aa5b1fde0dcd680b6e0fb7","status":"content_addressed_stable_baseline_descriptor","version":"v40.03r09.1"}
