{"artifacts":[{"name":"main.pdf","sha256":"ae8d89e90ece0dcefab83ba44b2fd1e9de73ba7d04abe7501192b085ab652ca0"},{"name":"manual.pdf","sha256":"19df9a7711861bb0cbc1a5e71491d3b605ff73a4bf05bbf108241b9f3f4c5112"},{"name":"manual-2.pdf","sha256":"b7ee3853c59b77d7779287ccbeb71928fb45b4a9c75dbf632603c9854c07eb01"},{"name":"source.zip","sha256":"4f681f468f78f58b682e0875a3406f8c7799ed80191b0f3909177b3afb5fe149"}],"canonical_bundle_availability":"embedded_as_stable_payload_in_complete_bundle","dependency_id":"AOD","payload_manifest_sha256":"01d50e18e50bf5ccfafa012994ba5a5b457a4f0460ce1da14de9794f8d1145de","schema_version":"3.1","snapshot_id":"AOD_STABLE_BOOTSTRAP_v40.03r17.1_GO","source_bundle_filename":"bundle-v40.03r17.1-go.zip","source_bundle_sha256":"a5cf5957121c5b56d25ad06fc24ff930665fbbdcf83ae1a79008c500bf062a10","status":"content_addressed_stable_baseline_descriptor","version":"v40.03r17.1"}
